{
  "schema_version": "2.1",
  "event_id": "2ce1c877-0245-4c31-9fd8-a39bd76900d1",
  "trigger": "comment",
  "source_app": "mimotrust_controlled_content",
  "provider": {
    "provider_id": "mimotrust_sandbox",
    "application_id": "com.mimotrust.controlledcontent"
  },
  "content_ref": {
    "content_type": "video",
    "content_id": "video-001",
    "content_version": "v1",
    "content_hash": "0f6c57d2f3f2772a3abfde87b52123c45228a420e40cada19035dd26afa2f734",
    "canonical_url": "https://sandbox.mimotrust.local/content/video-001"
  },
  "content_access": {
    "mode": "grant_exchange",
    "exchange_url": "https://gateway.mimotrust.local/v1/grants/exchange",
    "grant_code": "demo-grant-video-001-0001",
    "audience": "mimotrust_guardian_backend",
    "expires_at": "2026-08-01T20:03:00+08:00",
    "scopes": ["manifest:read", "asset:read"]
  },
  "view_state": {
    "position_ms": 3500,
    "duration_ms": 22467,
    "is_playing": true
  },
  "observed_at": "2026-08-01T20:00:00+08:00"
}
